question,answer
How can I get started with Sikka Prime?,Interested users can request a demo of Sikka Prime on the Sikka website or contact Sikka directly for more information.
What is Sikka Insights?,Sikka Insights is a business intelligence and analytics platform that provides real-time data analysis for the dental industry.
How does Sikka Insights work?,Sikka Insights works by integrating with various dental practice management software to collect data in real-time. It then applies advanced analytics and machine learning algorithms to provide actionable insights to dental practices.
What kind of data can I get from Sikka Insights?,"With Sikka Insights, you can get data on key performance indicators such as production, collections, new patients, procedures, and insurance. You can also get patient satisfaction metrics, fee data, and industry benchmarks."
What are the benefits of using Sikka Insights?,"Some of the benefits of using Sikka Insights include increased efficiency, improved profitability, and better patient care. The platform enables dental practices to make data-driven decisions and optimize their operations."
How can I integrate Sikka Insights with my practice management software?,Sikka Insights integrates with over 96% of dental practice management software systems in the United States. You can connect your practice management software to Sikka Insights through a secure API connection.
Is Sikka Insights HIPAA compliant?,"Yes, Sikka Insights is fully HIPAA compliant. The platform uses industry-standard encryption and security protocols to ensure the safety and privacy of patient data."
Can Sikka Insights help me improve my patient experience?,"Yes, Sikka Insights provides data on patient satisfaction metrics such as wait times, chair time, and treatment acceptance rates. With this data, you can identify areas for improvement and make changes to enhance the patient experience."
How does Sikka Insights protect my data?,"Sikka Insights uses advanced security protocols such as encryption, access control, and data backup to protect your data. The platform also undergoes regular security audits to ensure compliance with industry standards."
What kind of support does Sikka Insights offer?,"Sikka Insights offers comprehensive support to its customers, including email and phone support, online training resources, and a dedicated customer success team."
How much does Sikka Insights cost?,The cost of Sikka Insights varies depending on the size of your practice and the specific features you need. Contact Sikka Sales for a customized quote.
How long does it take to set up Sikka Insights?,"The set-up time for Sikka Insights depends on your practice management software and the size of your practice. Generally, the set-up process takes between one and two weeks."
Can Sikka Insights integrate with my digital imaging software?,"Yes, Sikka Insights can integrate with various digital imaging software systems, including Dexis, Schick, and Gendex."
What are the system requirements for using Sikka Insights?,"Sikka Insights is a cloud-based platform that can be accessed through a web browser. There are no specific system requirements, but a reliable internet connection is necessary."
How can I access my Sikka Insights data?,You can access your Sikka Insights data through a web browser or mobile device. The platform also provides customizable reports and dashboards for easy data analysis.
How does Sikka Insights ensure the accuracy of its data?,Sikka Insights uses advanced analytics and machine learning algorithms to ensure the accuracy of its data. The platform also undergoes regular data validation and verification processes.
Can I customize the data I receive from Sikka Insights?,"Yes, Sikka Insights provides customizable reports and dashboards that allow you to choose the specific data you want to see."
What are some of the latest trends in the dental industry?,"Some of the latest trends in the dental industry include teledentistry, digital dentistry, AI-powered practice management software, and patient communication tools."
"What is teledentistry, and how can it benefit dental practices?","Teledentistry is the provision of dental care services using telecommunication technology. It can benefit dental practices by allowing them to expand their patient reach, improve access to care, and provide remote consultations and follow-ups."
"What is digital dentistry, and how is it transforming the dental industry?","Digital dentistry involves the use of digital technologies to improve the design, production, and delivery of dental restorations, prostheses, and appliances. It is transforming the dental industry by enabling more precise, efficient, and personalized treatments."
How can AI-powered practice management software help dental practices operate more efficiently?,"AI-powered practice management software can help dental practices automate repetitive tasks, optimize workflows, and improve patient engagement and satisfaction. It can also provide valuable insights into practice performance and profitability."
What are some of the key benefits of using patient communication tools in dental practices?,"Patient communication tools can help dental practices improve patient engagement, satisfaction, and retention. They can also reduce no-shows, increase case acceptance rates, and enhance practice reputation and brand loyalty."
What are some of the most common challenges facing dental practices today?,"Some of the most common challenges facing dental practices today include increasing competition, rising costs, changing patient expectations, and evolving regulatory requirements."
How can dental practices address the challenge of increasing competition?,"Dental practices can address the challenge of increasing competition by differentiating themselves through unique value propositions, specialized services, exceptional patient experiences, and effective marketing strategies."
How can dental practices manage rising costs without compromising on quality of care?,"Dental practices can manage rising costs by adopting cost-effective technologies, optimizing workflows, reducing waste and inefficiencies, negotiating better prices with suppliers, and increasing revenue through value-added services."
How can dental practices leverage patient data to improve patient outcomes and practice performance?,"Dental practices can leverage patient data by collecting, analyzing, and interpreting it to identify patterns, trends, and insights that can inform clinical decision-making, treatment planning, and practice management strategies."
How can dental practices ensure compliance with regulatory requirements such as HIPAA?,"Dental practices can ensure compliance with regulatory requirements such as HIPAA by implementing appropriate policies, procedures, and safeguards for data privacy and security, providing staff training and education, and conducting regular audits and assessments."
What are some of the best practices for managing dental practice finances?,"Some of the best practices for managing dental practice finances include tracking and monitoring key performance indicators, budgeting and forecasting, managing cash flow, reducing overhead costs, and investing in revenue-generating activities."
How can dental practices improve patient satisfaction and loyalty?,"Dental practices can improve patient satisfaction and loyalty by providing exceptional patient experiences, personalized and compassionate care, effective communication, and convenient access to care."
What are some of the most effective marketing strategies for dental practices?,"Some of the most effective marketing strategies for dental practices include building a strong online presence, leveraging social media and review sites, offering referral incentives, partnering with other healthcare providers, and participating in community events."
How can dental practices attract and retain top talent?,"Dental practices can attract and retain top talent by offering competitive compensation and benefits, providing opportunities for professional development and growth, fostering a positive and supportive workplace culture, and recognizing and rewarding performance and achievements."
What are economic indicators?,"Economic indicators are statistics that provide insight into the performance and health of an economy. They can include measures such as GDP, inflation rates, unemployment rates, consumer spending, and business investment."
How are economic indicators used by policymakers and investors?,"Economic indicators are used by policymakers and investors to gauge the overall health and direction of an economy, identify trends and risks, and inform decision-making around monetary and fiscal policies, investment strategies, and business planning."
"What is GDP, and why is it an important economic indicator?","GDP, or Gross Domestic Product, is the total value of goods and services produced in a country over a specific period of time. It is an important economic indicator because it reflects the size and growth rate of an economy and provides a measure of its overall health and productivity."
"What is inflation, and how is it measured?","Inflation is a sustained increase in the general price level of goods and services over time. It is typically measured using the Consumer Price Index (CPI), which tracks changes in the prices of a basket of goods and services consumed by households."
How does unemployment rate affect the economy?,"Unemployment rate is a measure of the number of people who are unemployed and actively seeking work as a percentage of the total labor force. It can affect the economy by reducing consumer spending, increasing social costs, and creating social and political instability."
"What is the Purchasing Managers Index (PMI), and how is it used as an economic indicator?","The Purchasing Managers Index (PMI) is a measure of the economic activity in the manufacturing and services sectors. It is based on surveys of purchasing managers and provides insight into trends in production, new orders, employment, and supplier deliveries."
"What is the Consumer Confidence Index (CCI), and why is it important?","The Consumer Confidence Index (CCI) is a measure of consumers' attitudes and expectations about the economy and their own financial situation. It is important because consumer spending drives a significant portion of economic activity, and consumer confidence can influence spending patterns."
How is the Stock Market used as an economic indicator?,"The stock market is used as an economic indicator because it reflects investors' expectations and perceptions about the future performance of companies and the economy as a whole. It can also influence consumer and business confidence, and impact investment decisions and capital flows."
"What is the Federal Funds Rate, and how does it affect the economy?","The Federal Funds Rate is the interest rate at which banks lend and borrow money from each other overnight. It is set by the Federal Reserve and is used to influence the supply of money and credit in the economy. Changes in the Federal Funds Rate can affect borrowing costs, inflation, and employment."
"What is the yield curve, and how is it used as an economic indicator?","The yield curve is a graphical representation of the relationship between the yields on bonds with different maturities. It is used as an economic indicator because it can provide insights into expectations for future economic growth, inflation, and monetary policy."
"What is the Leading Economic Index (LEI), and how is it used to forecast economic activity?",The Leading Economic Index (LEI) is a composite index of 10 economic indicators that are believed to be predictive of future economic activity. It is used to forecast economic trends and provide insight into the direction and pace of economic growth.
How is the housing market used as an economic indicator?,"The housing market is used as an economic indicator because it reflects trends in consumer spending, employment, and overall economic activity"
"What is Sikka Software, and what does it do?","Sikka Software is a cloud-based platform that provides analytics, automation, and integration solutions for the dental, veterinary, audiology, and optometry industries. Its solutions help practitioners and service providers to optimize their workflows, improve patient care, and increase profitability."
"When was Sikka Software founded, and who are its founders?","Sikka Software was founded in 2005 by Vijay Sikka and his wife, Jyothi Sikka."
What are the different solutions offered by Sikka Software?,"Sikka Software offers a range of solutions for the dental, veterinary, audiology, and optometry industries, including Sikka Insights, Sikka Marketplace, Sikka Payments, Sikka Platform, and Sikka Practice Optimizer."
"What is Sikka Insights, and how does it work?","Sikka Insights is a cloud-based data analytics platform that provides insights and benchmarks for the dental, veterinary, audiology, and optometry industries. It uses data from over 32,000 practice locations to provide practitioners with real-time performance metrics and comparisons against industry standards."
"What is Sikka Marketplace, and how does it work?","Sikka Marketplace is an online marketplace that connects practitioners with suppliers and service providers in the dental, veterinary, audiology, and optometry industries. It allows practitioners to order supplies and equipment, and access professional services such as marketing and financing."
"What is Sikka Payments, and how does it work?","Sikka Payments is a payment processing solution that allows dental, veterinary, audiology, and optometry practices to accept credit and debit card payments from patients. It is integrated with Sikka's other solutions to provide seamless payment processing and accounting."
"What is Sikka Platform, and how does it work?",Sikka Platform is a cloud-based integration platform that allows practitioners and service providers to connect and exchange data with each other and with third-party applications. It provides a unified view of practice data and streamlines workflows.
"What is Sikka Practice Optimizer, and how does it work?","Sikka Practice Optimizer is a suite of automation tools that help dental, veterinary, audiology, and optometry practices to streamline their workflows and improve patient care. It includes tools for appointment reminders, patient communication, insurance verification, and claims management."
What is the mission of Sikka Software?,"The mission of Sikka Software is to transform the healthcare industry by empowering practitioners and service providers with data-driven insights, automation tools, and seamless integration solutions."
What are the values of Sikka Software?,"The values of Sikka Software are innovation, excellence, customer focus, teamwork, and integrity."
How does Sikka Software ensure the security of its customers' data?,Sikka Software uses advanced encryption and security protocols to protect its customers' data from unauthorized access and theft. It also undergoes regular security audits and certifications to ensure compliance with industry standards.
What is the pricing model for Sikka Software's solutions?,The pricing model for Sikka Software's solutions varies depending on the specific solution and the size and needs of the practice. It offers both monthly subscription plans and customized enterprise solutions.
How does Sikka Software provide customer support?,"Sikka Software provides customer support through a range of channels, including phone, email, chat, and an online knowledge base. It also offers training and onboarding services to help practitioners and service providers get the most out of its solutions."
What are the benefits of using Sikka Software's solutions for dental practices?,"The benefits of using Sikka Software's solutions for dental practices include improved operational efficiency, better patient care, increased revenue and profitability, and enhanced visibility into practice performance. Its solutions can help dental practices to automate tasks such as appointment reminders, claims management, and insurance verification, and provide insights into key performance metrics such as case acceptance, production, and collections."
What are the benefits of using Sikka Software's solutions for veterinary practices?,"The benefits of using Sikka Software's solutions for veterinary practices include improved practice management, better patient care, increased revenue and profitability, and enhanced communication with clients. Its solutions can help veterinary practices to automate tasks such as appointment scheduling, prescription management, and lab results tracking, and provide insights into key performance metrics such as patient visits, revenue per visit, and client retention."
What are the benefits of using Sikka Software's solutions for audiology practices?,"The benefits of using Sikka Software's solutions for audiology practices include improved patient care, increased revenue and profitability, and enhanced practice management. Its solutions can help audiology practices to automate tasks such as appointment scheduling, patient communication, and billing, and provide insights into key performance metrics such as hearing aid sales, patient retention, and revenue per patient."
What are the benefits of using Sikka Software's solutions for optometry practices?,"The benefits of using Sikka Software's solutions for optometry practices include improved practice management, better patient care, increased revenue and profitability, and enhanced communication with patients. Its solutions can help optometry practices to automate tasks such as appointment scheduling, insurance verification, and prescription management, and provide insights into key performance metrics such as patient visits, revenue per visit, and appointment no-show rates."
How does Sikka Software help its customers to stay up-to-date with industry trends and best practices?,"Sikka Software provides its customers with a range of resources to help them stay up-to-date with industry trends and best practices. These include industry reports and analysis, webinars and training sessions, and a blog with articles and insights from industry experts."
What is Sikka Software's approach to innovation?,"Sikka Software's approach to innovation is to constantly seek out new ways to use technology to solve the challenges faced by practitioners and service providers in the healthcare industry. It invests heavily in research and development, and works closely with its customers to understand their needs and pain points."
What is Sikka Software's vision for the future of healthcare?,"Sikka Software's vision for the future of healthcare is a world where practitioners and service providers have access to real-time data and insights that enable them to provide the best possible care to their patients. It sees technology as a key enabler of this vision, and is committed to developing innovative solutions that help to transform the healthcare industry."
What is the mission of Sikka Software?,"The mission of Sikka Software is to help healthcare providers improve their practices by providing powerful, cloud-based tools that are easy to use and affordable."
Who founded Sikka Software?,Sikka Software was founded by Vijay Sikka in 2004.
What types of healthcare providers does Sikka Software serve?,"Sikka Software serves a wide range of healthcare providers, including dental, veterinary, audiology, optometry, chiropractic, and oral surgery practices."
What is the Sikka Platform Cloud?,The Sikka Platform Cloud is a cloud-based platform that provides a wide range of API services for healthcare providers.
What are the benefits of using the Sikka Platform Cloud?,"The benefits of using the Sikka Platform Cloud include real-time data analytics, patient communication and engagement tools, billing and payment processing, inventory management, and much more."
What is the Sikka Marketplace?,The Sikka Marketplace is an online store where healthcare providers can purchase and download apps and services that integrate with the Sikka Platform Cloud.
What types of apps and services are available on the Sikka Marketplace?,"The Sikka Marketplace offers a wide range of apps and services, including patient communication and engagement tools, billing and payment processing solutions, inventory management tools, and much more."
Can I customize my Sikka Software experience?,"Yes, Sikka Software offers a wide range of customization options that allow you to tailor your experience to meet your unique needs."
What kind of support does Sikka Software offer?,"Sikka Software offers a variety of support options, including phone support, email support, and an online knowledge base."
How much does Sikka Software cost?,The cost of Sikka Software varies depending on the specific tools and services you need. Contact Sikka Software for a customized pricing quote.
What are the system requirements for using Sikka Software?,The system requirements for using Sikka Software vary depending on the specific tools and services you need. Contact Sikka Software for more information.
What is Sikka Insights?,Sikka Insights is a powerful data analytics tool that allows healthcare providers to analyze key performance metrics and make data-driven decisions.
Can I access Sikka Insights on my mobile device?,"Yes, Sikka Insights is available on both iOS and Android devices."
What is Sikka Marketplace Pro?,Sikka Marketplace Pro is a premium version of the Sikka Marketplace that offers advanced features and services.
How do I sign up for Sikka Marketplace Pro?,Contact Sikka Software to learn more about signing up for Sikka Marketplace Pro.
What is the Sikka Data Cloud?,"The Sikka Data Cloud is a secure, cloud-based platform that allows healthcare providers to securely store and manage patient data."
Is the Sikka Data Cloud HIPAA compliant?,"Yes, the Sikka Data Cloud is fully HIPAA compliant."
How can Sikka Software help me grow my practice?,"Sikka Software can help you grow your practice by providing tools that streamline your workflow, improve patient engagement, and boost your revenue."
What kind of training does Sikka Software offer?,"Sikka Software offers a variety of training options, including online training, on-site training, and custom training packages."
How do I get started with Sikka Software?,Contact Sikka Software to schedule a demo and learn more about how Sikka Software can help your practice.
What is One API by Sikka Software?,"One API is a suite of cloud-based APIs offered by Sikka Software that provide healthcare providers with real-time data analytics, patient engagement tools, billing and payment processing, and much more."
What are the benefits of using One API?,"The benefits of using One API include increased efficiency, improved patient engagement and communication, and enhanced revenue management."
What types of healthcare providers does One API serve?,"One API serves a wide range of healthcare providers, including dental, veterinary, audiology, optometry, chiropractic, and oral surgery practices."
What is the Sikka One API Marketplace?,The Sikka One API Marketplace is an online store where healthcare providers can purchase and download apps and services that integrate with the One API platform.
What types of apps and services are available on the Sikka One API Marketplace?,"The Sikka One API Marketplace offers a wide range of apps and services, including patient communication and engagement tools, billing and payment processing solutions, inventory management tools, and much more."
Can I customize my One API experience?,"Yes, One API offers a wide range of customization options that allow you to tailor your experience to meet your unique needs."
What kind of support does One API offer?,"One API offers a variety of support options, including phone support, email support, and an online knowledge base."
How much does One API cost?,The cost of One API varies depending on the specific tools and services you need. Contact Sikka Software for a customized pricing quote.
What are the system requirements for using One API?,The system requirements for using One API vary depending on the specific tools and services you need. Contact Sikka Software for more information.
What is the One API Dashboard?,The One API Dashboard is a real-time data analytics tool that allows healthcare providers to track key performance metrics and make data-driven decisions.
Can I access the One API Dashboard on my mobile device?,"Yes, the One API Dashboard is available on both iOS and Android devices."
What is the One API Payment Gateway?,"The One API Payment Gateway is a secure, cloud-based payment processing solution that allows healthcare providers to easily accept payments from patients."
Is the One API Payment Gateway secure?,"Yes, the One API Payment Gateway is fully secure and compliant with all relevant industry standards."
What is the One API Appointment Reminder?,The One API Appointment Reminder is a patient communication tool that automatically sends appointment reminders to patients via text message or email.
How does the One API Appointment Reminder work?,The One API Appointment Reminder integrates with your practice management software to automatically send appointment reminders to patients based on their appointment history.
What is the One API Inventory Management tool?,The One API Inventory Management tool is a cloud-based solution that allows healthcare providers to easily manage their inventory and track usage.
What are the benefits of using the One API Inventory Management tool?,"The benefits of using the One API Inventory Management tool include reduced waste, improved efficiency, and enhanced revenue management."
