question,answer
Why is ONE API important for practice management software development?,ONE API reduces the complexity and maintenance involved in in-house ETL development for practice management software and gets PMS integrated apps to market faster.
What is the ONE data model?,The ONE data model is a unified data model used by ONE API to ensure that request and response data structures are identical across all the practice management software connectors in a single category.
What is the ONE set of API endpoints?,The ONE set of API endpoints is a feature of ONE API that allows a single API request format to work with all practice management software connectors within a single category.
What is the ONE onboard flow for practices?,The ONE onboard flow for practices is a feature provided by Sikka that provides a unified Marketplace flow to onboard practices.
What industries does Sikka's ONE API support?,Sikka's ONE API supports over 400 practice management software integrations across the dental veterinary physician chiropractic and optometry industries.
What can users do with Sikka's ONE API?,Users can effortlessly connect any practice management software and analyze data using Sikka's ONE API.
What is the Practice Query Language API?,The Practice Query Language API allows developers to control individual data points to be displayed leading to faster and more efficient app performance.
What is the Payment Write Back API used for?,The Payment Write Back API provides information on appointment status payment new appointment new patients notes claim notes status insurance status and lab results enabling automation of claims and payment write back.
What is the Patient360 API?,The Patient360 API enables access to consent-based patient data from multiple practice management systems including demographic appointments transactions insurance details and treatment plans among other information sets.
What are the features and pricing of the OneAPI Developer Package?,The OneAPI Developer Package includes features such as Sikka Marketplace Trends Overview Practices Providers Employers Patients/Pets Appointments Treatment plans Transactions Procedure codes Insurance and guarantor account and more. It has an API rate limit per practice per minute of 20 a record limit of 5000 data refresh once a day and standard email support. It is free to use in the sandbox environment.
What are the features and pricing of the OneAPI Silver Package?,The OneAPI Silver Package includes features such as Sikka Marketplace Trends Overview Practices Providers Employers Patients/Pets Appointments Treatment plans Transactions Procedure codes Insurance and guarantor account Procedure codes mapping SPU support portal and more. It has an API rate limit per practice per minute of 120 a record limit of 5000 data refresh in near real-time (as little as 5 minutes) and Sikka priority technical support. It costs $35 per month per location.
What are the features and pricing of the OneAPI Gold Package?,The OneAPI Gold Package includes features such as Sikka Marketplace Trends Overview Practices Providers Employers Patients/Pets Appointments Treatment plans Transactions Procedure codes Insurance and guarantor account Procedure codes mapping SPU support portal Insurance companies claims claim description payment types fee optimizer and practice optimizer KPIs national trends images available in the PMS and more. It has an API rate limit per practice per minute of 120 a record limit of 100 data refresh in near real-time (as little as 5 minutes) and Sikka priority technical support. It costs $45 per month per location.
What are the features and pricing of the OneAPI Platinum Package?,The OneAPI Platinum Package includes features such as Sikka Marketplace Trends Overview Practices Providers Employers Patients/Pets Appointments Treatment plans Transactions Procedure codes Insurance and guarantor account Procedure codes mapping SPU support portal Insurance companies claims claim description payment types fee optimizer and practice optimizer KPIs national trends images available in the PMS X-Rays from select platforms AI-generated Economic Well Being Health Risk Scores for Patients Customer Life Time Value and Next major Procedure Prediction Payment APIs and Insurance Eligibility Lookup among others. It has an API rate limit per practice per minute of 120 a record limit of 100 data refresh in near real-time (as little as 5 minutes) and Sikka priority technical support. It costs $125 per month per location.
What percentage of markets is Sikka API compatible with?,Sikka API is compatible with approximately 90% of the markets for dental veterinary optometry chiropractic orthodontics oral surgery and others in the U.S. Canada Australia and New Zealand.
What options are available with Sikka API?,Sikka API offers options for multiple countries financial system integration credit card processing artificial intelligence and predictive analytics APIs with location enabled features and secure real time video audio communication.
What is the process for using OneAPI?,The process for using OneAPI involves three steps: 1) Connect to practices by registering on the Sikka Marketplace 2) Install the Sikka Platform Utility on the practice server and 3) Fetch data via API.
Does Sikka Software Corporation offer warranties or guarantees for compatibility?,No Sikka Software Corporation offers no warranties or guarantees for compatibility as it is constantly varying.
Where can one get started with OneAPI?,One can get started with OneAPI by visiting https://api.sikkasoft.com/portal/Home.htm.
What is the Practice Query Language API?,The Practice Query Language API allows developers to control individual data points to be displayed leading to faster and more efficient app performance.
What is the Payment Write Back API used for?,The Payment Write Back API provides information on appointment status payment new appointment new patients notes claim notes status insurance status and lab results enabling automation of claims and payment write back.
What is the Patient360 API?,The Patient360 API enables access to consent-based patient data from multiple practice management systems including demographic appointments transactions insurance details and treatment plans among other information sets.
What are the features and pricing of the OneAPI Developer Package?,The OneAPI Developer Package includes features such as Sikka Marketplace Trends Overview Practices Providers Employers Patients/Pets Appointments Treatment plans Transactions Procedure codes Insurance and guarantor account and more. It has an API rate limit per practice per minute of 20 a record limit of 5000 data refresh once a day and standard email support. It is free to use in the sandbox environment.
What are the features and pricing of the OneAPI Silver Package?,The OneAPI Silver Package includes features such as Sikka Marketplace Trends Overview Practices Providers Employers Patients/Pets Appointments Treatment plans Transactions Procedure codes Insurance and guarantor account Procedure codes mapping SPU support portal and more. It has an API rate limit per practice per minute of 120 a record limit of 5000 data refresh in near real-time (as little as 5 minutes) and Sikka priority technical support. It costs $35 per month per location.
What are the features and pricing of the OneAPI Gold Package?,The OneAPI Gold Package includes features such as Sikka Marketplace Trends Overview Practices Providers Employers Patients/Pets Appointments Treatment plans Transactions Procedure codes Insurance and guarantor account Procedure codes mapping SPU support portal Insurance companies claims claim description payment types fee optimizer and practice optimizer KPIs national trends images available in the PMS and more. It has an API rate limit per practice per minute of 120 a record limit of 100 data refresh in near real-time (as little as 5 minutes) and Sikka priority technical support. It costs $45 per month per location.
What are the features and pricing of the OneAPI Platinum Package?,The OneAPI Platinum Package includes features such as Sikka Marketplace Trends Overview Practices Providers Employers Patients/Pets Appointments Treatment plans Transactions Procedure codes Insurance and guarantor account Procedure codes mapping SPU support portal Insurance companies claims claim description payment types fee optimizer and practice optimizer KPIs national trends images available in the PMS X-Rays from select platforms AI-generated Economic Well Being Health Risk Scores for Patients Customer Life Time Value and Next major Procedure Prediction Payment APIs and Insurance Eligibility Lookup among others. It has an API rate limit per practice per minute of 120 a record limit of 100 data refresh in near real-time (as little as 5 minutes) and Sikka priority technical support. It costs $125 per month per location.
Who is CFO of Sikka.ai,Jasprit Sandhu
What is Prasad Khandat's role at Sikka.ai?,Prasad is the Head of Engineering at Sikka.ai.
What are Prasad Khandat's responsibilities at Sikka.ai?,Prasad is responsible for Sikka.ai's technical strategy and global oversight of all engineering development and operations teams.
When did Prasad Khandat join Sikka.ai and in what role?,Prasad joined Sikka.ai in 2014 as a Software Engineer.
Which product did Prasad Khandat lead while working at Sikka.ai?,"Prasad led Sikka.ai's flagship product ""Practice Optimizer""."
What is Prasad Khandat's experience in software engineering?,Prasad has extensive experience in software engineering and lifecycle.
Has Prasad Khandat won any awards at Sikka.ai?,"Yes,  Prasad has won Sikka.ai's internal hackathon competition for two consecutive years and has been awarded as the best performer for his excellent work at Sikka.ai multiple times."
Where did Prasad Khandat work prior to joining Sikka.ai?,"Prasad worked for four years at iBrain Decision Software,  India as Sr. Software Engineer."
What is Prasad Khandat's educational background?,"Prasad did his masters in computer science from the University of Pune,  Maharashtra, India"
What is scrutinized during the life insurance application process?,"An applicant's self-disclosed medical and smoking history is critically scrutinized during the life insurance application process for simplified, accelerated, and full underwriting."
What are some known practices and diseases that increase mortality risks?,"Hypertension, diabetes, kidney disorders, heart disorders, and tobacco use are known to increase mortality risks."
What is the purpose of ExamOne and Quest Diagnostics' commitment to delivering solutions?,"ExamOne and the entire Quest Diagnostics family are committed to working tirelessly to deliver solutions that will help them work through changes and challenges in the healthcare  life insurance, and retail markets.
"
What is Sikka.ai?,Sikka.ai is a platform that offers a way to evaluate opportunities for production growth and gauge ROI for certain investments at a quick glance using Optimizer. It also provides insights into 5 different healthcare verticals and has a growing international presence.
What is the collaboration between ExamOne and Sikka.ai?,"In April 2022, ExamOne and Sikka.ai announced a collaboration to provide oral healthcare information through HealthPiQture.
"
What is the Sikka.ai Health Indicators whitepaper about?,The Sikka.ai Health Indicators whitepaper is about the use of Sikka.ai Health Indicators to identify health risks among insurance applicants.
What is the classic Dr. Copper comparison?,The classic Dr. Copper comparison compares copper prices to the inflation rate over the same time period.
What are the advantages of Sikka.ai ONE API over its competitors?,"Sikka.ai ONE API offers several key advantages over its competitors, including robust data analytics, customizable dashboards, and integrated payment processing, making it a more comprehensive and effective solution for healthcare providers."
Who does ExamOne work with to capture a more comprehensive review of applicants' prescription drug history?,ExamOne works with some of the largest pharmacy benefits management (PBM) companies in the country and has developed exclusive relationships with them to capture a more comprehensive review of applicants' prescription drug history.
What do the API Awards celebrate?,"The API Awards celebrate innovation, adoption and reception in the API & microservices industry and by the developer community.
"
What can you use Sikka.ai's Fee Survey for?,"Sikka.ai's Fee Survey lets you choose up to three zip codes for which you will receive 50th, 60th, 70th, 80th, 90th and maximum percentile fees across 900 different procedure codes."
What has validated Sikka.ai's data?,"Sikka.ai's data has been validated in studies conducted by 3 major reinsurance companies, 3 leading data providers  several carriers and MGAs in both the US and Canada, and a leading life settlement company."
What is the gross protective value of Sikka.ai's Tobacco indicators?,Studies of Sikka.ai's Tobacco indicators have been completed to identify gross protective value of almost 10x the cost.
What does Munich Re recommend each carrier perform regarding the Sikka.ai Tobacco Score?,Munich Re recommends each carrier perform a retrospective study to best assess the value and application of the Sikka.ai Tobacco Score on its company-specific insured population.
What is the goal of Sikka.ai Insights?,The goal of Sikka.ai Insights is to provide consent-based insights and services to life insurance underwriters and correlate oral health with mortality through multiple indicators.
What do the API Awards celebrate?,"The API Awards celebrate innovation, adoption and reception in the API & microservices industry and by the developer community.
"
What can you do to ensure maximum payment on procedures?,"When reviewing production reports from the previous year, you can visually look for any outliers and adjust accordingly to ensure maximum payment on procedures.
"
What does Sikka.ai's Fee Survey provide?,"Sikka.ai's Fee Survey lets you choose up to three zip codes for which you will receive 50th, 60th, 70th, 80th, 90th and maximum percentile fees across 900 different procedure codes."
Has Sikka.ai's data been validated?,"Yes, Sikka.ai's data has been validated in studies conducted by 3 major reinsurance companies, 3 leading data providers, several carriers and MGAs in both the US and Canada, and a leading life settlement company.
"
What has the tobacco indicator identified?,"The tobacco indicator has identified significant numbers of smoking non-disclosers that cost carriers as much as $23,0001 per traditional term policyholder in lost premiums due to misclassification, based on the analysis of 1 of the data providers.
"
What are Sikka.ai Indicators?,Separately Sikka.ai Indicators are now in production with multiple carriers and have been helpful at identifying missing underlying conditions that influence underwriting.
What did Munich Re do to validate Sikka.ai's Tobacco Score?,"In 2019, Munich Re performed a validation of Sikka.ai's Tobacco Score using insured records.
"
What kind of predictions can be made using Sikka.ai's API solutions?,Actionable predictions of the performance of specific public companies that are suppliers to these healthcare sectors can be made using Sikka.ai's API solutions.
What does Sikka.ai's Payment Write Back API provide information on?,Sikka.ai's Payment Write Back API provides information on apportioning bulk payment requests to individual patients.
What is Sikka.aiPay?,"Sikka.aiPay makes apportioning bulk payment requests to individual patients a snap. And they can be sent via text2pay  email or mobile app.
"
What is Sikka.ai ONE API?,Sikka.ai ONE API is utilized by partners (many of them Fortune 500 companies) to build innovative apps to optimize the business of healthcare. It won the Best Health API Award for 2022 and 2019 from API World.
How does Sikka.ai provide tailored solutions for veterinary practices?,"At Sikka.ai, tailored solutions for veterinary practices are provided by utilizing their award-winning health API platform to help increase efficiency and optimize practice.
"
What kind of service is ideal for point-of-sale insurance products?,The service provided by Sikka.ai is ideal for point-of-sale insurance products where an immediate response is needed.
What can healthcare providers track and analyze using Sikka.ai's data analytics?,"Healthcare providers can track and analyze key performance metrics, such as patient volume, revenue, and patient satisfaction using Sikka.ai's data analytics.
PatientHomePage is a tool that helps strengthen doctor-patient relationships by allowing practices to take control of their campaigns, patient communications, practice calendar  and more."
What is Sikka.ai Prime?,Sikka.ai Prime provides key information in one location to help you make informed decisions when offering treatment plans and payment options to patients.
What safety procedures have ExamOne implemented during the health crisis?,ExamOne has implemented rigorous safety procedures to protect employees and customers during the health crisis.
What is Practice Query Language API?,"Practice Query Language API lets you control individual data points you want to display  allowing your app to run faster and more efficiently.
"
Which healthcare markets does Sikka.ai API work with and is compatible with?,"Sikka.ai API works with and is compatible with approximately 90% of the markets for dental, veterinary, optometry, chiropractic, orthodontics, oral surgery and others in the U.S., Canada, Australia and New Zealand."
How many examiners does ExamOne plan to add to its network by the end of the year?,200 examiners to its network by the end of the year.
What is Life Insurance Awareness Month?,Life Insurance Awareness Month is recognized in September every year to promote the importance of life insurance.
What is the Fee Survey?,"The Fee Survey provides fee recommendations to practitioners who want to maximize production, retain/acquire patients, and manage overall costs.
"
What is the Morning Report?,The Morning Report provides an overview of practice operations for the day.
What is LECA RS validation?,LECA RS validation is depicted in the figure below.
What is the goal of Sikka.ai API for healthcare offices?,"The goal of Sikka.ai API is to provide a single API that enables over 50 best-in-class productivity applications for dental, veterinary, optometry, chiropractors, and other healthcare offices."
What does ExamOne do besides mortality research and industry partnerships with MIB Solutions?,"In addition to mortality research and industry partnerships with MIB Solutions, ExamOne provides more than 3,000 tests to clinical laboratory clients and examines the applicability and usefulness of these clinical tests to insurance clients. There are also ongoing efforts to identify new assays for markers critical to the risk assessment testing industry.
"
What is Sikka.ai's focus in providing solutions for dental practices?,Sikka.ai prides itself on providing tailored solutions for dental practices by utilizing their award-winning health API platform to help increase efficiency and optimize the practice.
How many total dental installations does Sikka.ai have on their platform?,"Sikka.ai has over 28,000 total dental installations on their platform.
"
How many dental patients are on the Sikka.ai platform?,There are over 136 million dental patients on the Sikka.ai platform.
What are the dental products offered by Sikka.ai?,"Sikka.ai offers several dental products including Sikka.ai Prime, Optimizer,Sikka.aiPay,Fee Survey,PatientHomePage,and Practice Mobilizer."
What is Sikka.ai Prime?,"Sikka.ai Prime is a tool that helps dental practices get the most out of their practice each day by removing ""busyness"" from their business so they can deliver outstanding patient care."
What is Optimizer by Sikka.ai?,Optimizer is a tool offered by Sikka.ai that allows dental practices to optimize their practice and maximize their profits through informative dashboards that are updated in real-time.
What is Sikka.aiPay?,"Sikka.aiPay is a payment processing tool that uses Sikka.ai's award-winning health API platform to streamline the payment process, reduce costs, and get dental practices paid faster.
"
What is Fee Survey by Sikka.ai?,"Fee Survey is a tool that provides fee recommendations for a practice's most popular procedures  helping practices avoid overcharging or undercharging and supercharge their profits.
"
What is PatientHomePage by Sikka.ai?,"PatientHomePage is a tool that helps strengthen doctor-patient relationships by allowing practices to take control of their campaigns, patient communications, practice calendar  and more."
What is Practice Mobilizer by Sikka.ai?,"Practice Mobilizer is a tool that allows dental practices to monitor their practice from their phone using Sikka.ai's API, which seamlessly integrates with the practice management system to allow for secure access to practice data from anywhere.
"
What is Sikka.ai Prime?,Sikka.ai Prime is a tool designed to help dental practices maximize efficiency and profitability.
What insights does Sikka.ai Prime offer?,"Sikka.ai Prime offers insights such as patient insurance eligibility, payment processing options, and more.
"
Who is Sikka.ai Prime currently available for?,"Sikka.ai Prime is currently available for the dental industry, for both solo practices and DSOs.
"
What information does Sikka.ai Prime provide in one location?,"Sikka.ai Prime provides key information in one location, allowing practices to make informed decisions when offering treatment plans and payment options to patients.
"
How does Sikka.ai Prime improve payment processing?,"Sikka.ai Prime's payment portal offers a variety of payment options such as PayNow, Text2Pay, and Payment Plans to find the right payment option for patients and ensure outstanding balances are paid sooner.
"
What scores has Sikka.ai created for patient management?,Sikka.ai has created two scores powered by artificial intelligence that help determine patient propensity to pay on time for treatment and which patients will stick to prescribed treatment plans.
More Information on Sikka.aiPay?, https://www.Sikka.ai/Sikka.aiPay/
What is Sikka.aiPay?,"Sikka.aiPay is a payment facilitator that integrates patient communications, revenue cycle, patient marketing, business performance management, and related software applications using the Sikka.ai API Platform."
What are the payment options available with Sikka.aiPay?,"Flexible payment options include bulk pay, text2pay, mobile app-based pay, installments, and email payments.
"
What are the features of Sikka.aiPay?,"The features of Sikka.aiPay include automatic payment posting, bulk payments and claims processing  card tokenization and secure encryption, and multiple payment options."
How can one sign up for Sikka.aiPay?,"One can contact sales to get a one-page signup form  complete it, and send it back to Sphere. After approval, they can start using Sikka.aiPay to charge and collect payments."
Question,Answer
What is the Sikka.ai API Platform?,"The Sikka.ai API Platform is an award-winning platform that integrates patient communications, revenue cycle, patient marketing, business performance management and related software applications."
What are the flexible payment options offered by Sikka.aiPay?,"Sikka.aiPay offers several flexible payment options, including secure bulk pay, text2pay, mobile app-based pay  and installments."
Is Sikka.aiPay compliant with security standards?,"Yes  Sikka.aiPay is compliant with both PCI and HIPAA security standards, ensuring transaction security for all payments.
"
How can Sikka.aiPay help health practices get paid faster?,"Sikka.aiPay provides several convenient ways for patients to pay including in-person,through a mobile app,online,and via email and text notifications,helping practices get paid faster."
How can practices get started with Sikka.aiPay?,"To get started with Sikka.aiPay, practices can contact sales to receive a one-page signup form. After completing and returning the form, they will receive a secure digital application that is pre-populated with their details. Once approved, they can start using Sikka.aiPay to charge and collect from patients."
What are some key features of Optimizer Enterprise?,"Optimizer Enterprise offers several key features, including practice, provider, enterprise, and DSO dashboards, month-to-month trends, insurance patient analysis, fee optimization  unique KPIs, advanced reports, and more.


"
How can Optimizer Enterprise help practices optimize their operations?,"Optimizer Enterprise provides valuable insights and KPIs based on a practice's raw operational data  allowing them to identify operational gaps and opportunities for growth. It also offers a dedicated manager to each DSO customer and is compatible with over 200 practice management systems.
"
What is the Morning Report offered by Optimizer Enterprise?,"The Morning Report is a valuable report offered by Optimizer Enterprise that provides an overview of a practice's operations for the day, offering insights into production  collections, and other important metrics."
What is Sikka.ai's Fee Survey tool?,"Sikka.ai's Fee Survey tool is a tool that leverages Sikka.ai's 15 years of experience and vast database to provide fee recommendations to practitioners who are interested in maximizing production, retaining/acquiring patients, and managing overall costs.
"
How often should a practitioner refresh their procedure fees using Fee Survey?,Sikka.ai highly recommends refreshing your procedure fees at least twice annually for optimal performance.
What industries is Fee Survey currently available for?,Fee Survey is currently available for the Dental and Veterinary industries.
