question,answer
What is Sikka.ai Insights?,"Sikka.ai Insights is a data collection platform that gathers real-time, de-identified data from dental, veterinary, and optometry health care providers to track trends at local  state, regional, or national levels."
What are the uses of Sikka.ai Insights?,"Sikka.ai Insights is used to increase customer retention, predict sales trends, find new customers, improve customer service, increase profits, manage target marketing campaigns, and provide solutions for payments."
How many opt-in dental practices and veterinary practices are reported in the U.S. and Canada by Sikka.ai Insights?,"Sikka has over 41,000 opt-in dental practices installed in the US and Canada through its market-leading API integration platform."
Why choose Sikka.ai Insights for life insurance companies?,"With over 50% share of oral care patient data, Sikka.ai Insights is well-positioned to be the premier provider of this opt-in, consent-based data to the life insurance industry. No other source can provide the same breadth and depth of opt-in oral care data. Sikka.ai Insights provides more accurate individual mortality estimates, consistency in underwriting practices, and improved fraud detection, among other benefits."
What is Sikka.ai Insights?,"Sikka.ai Insights collects up-to-the-minute, consent-based, deidentified data from dental, veterinary, and optometry health care providers, which utilizes our single API to seamlessly connect with Practice Management Systems. Practice-level data is aggregated to track trends at local, state, regional or national levels to drive actionable yet insightful decisions."
What industries is Sikka.ai rethinking?,"Sikka.ai is rethinking the retail healthcare, life insurance and markets industries."
What does the Sikka.ai platform connect to?,The Sikka.ai API Platform connects to 96% of the retail healthcare market and all practice management systems and financial systems practices use.
How many practice installations does Sikka.ai have on its platform?,Sikka.ai Software now has 35K+ practice installations on its platform.
What is the purpose of the Industry Trends website created by Sikka.ai?,"The Industry Trends website created by Sikka.ai can be accessed to see week-over-week performance of practices and track the correlation between certain practice data points and economic performance, including predicting future inflation indicators."
Who is the founder and CEO of Sikka.ai Software Corporation?,Vijay Sikka
What is Vijay Sikka's professional background?,"He has worked in Artificial Intelligence and decision systems for more than 25 years with large scale projects at Intel Corporation, National Institutes of Health, Glaxo Smith Kline, Roche and UCSF affiliates."
What are some conferences where Vijay Sikka has spoken at as an invited keynote speaker?,"Digital Health World Conferences in 2019 and 2020, AI Global Forum 2020 and Biohacking Congress in London in 2020."
Who is the Chief Financial Officer of Sikka.ai Software Corporation?,Jasprit Sandhu
Who is the CFO of Sikka.ai Software Corporation?,Jasprit Sandhu
What is a data pipeline?,"A data pipeline is a set of processes that are used to extract, transform, and load data from various sources into a target database or data warehouse."
What is Sikka.ai's focus in the physician industry?,Sikka.ai's focus in the physician industry is to provide tailored solutions to help increase efficiency and optimize practices by utilizing their award-winning health API platform.
What is the goal of Sikka.ai in the physician industry?,Sikka.ai's goal in the physician industry is to provide tailored solutions to help increase efficiency and optimize practices.
How does Sikka.ai aim to achieve its goals in the physician industry?,Sikka.ai aims to achieve its goals in the physician industry by utilizing their award-winning health API platform to provide tailored solutions to physicians.
What is the product offered by Sikka.ai to physicians?,Sikka.ai offers a health API platform to physicians which provides tailored solutions to help increase efficiency and optimize practices.
How can physicians benefit from Sikka.ai's health API platform?,"Physicians can benefit from Sikka.ai's health API platform by using its tailored solutions to help increase efficiency and optimize their practices, leading to improved patient care and financial performance."
What makes Sikka.ai's health API platform unique for the physician industry?,"Sikka.ai's health API platform is unique for the physician industry because it offers tailored solutions to address specific challenges faced by physicians, using real-time data analytics and machine learning algorithms to provide insights and recommendations for optimization."
What is Sanjay Rajak's job title?,Sanjay Rajak is the Head of Technology and API at sikka.ai.
"What is Sanjay Rajak's experience in API platform development?,","Sanjay Rajak has experience in real time high performing, high availability, and high reliability API platform processing billions of transactions."
What is Sanjay Rajak's educational background?,Sanjay Rajak received his bachelor's degree in Information Technology from C.U. Shah College of Engineering & Technology in India. He also received a postgraduate diploma in Information Technology from the Symbiosis Institute of Management Studies in India and has taken courses at Stanford.
What is Sanjay Rajak's role at Sikka.ai?,Sanjay Rajak leads technology and API development at Sikka.ai
What does Sikka.ai do?,"Sikka is reimagining the retail healthcare market using a single API cloud platform with Artificial Intelligence and Predictive Analytics. We focus on non-physician practices including dentistry, veterinary, optometry, chiropractic, orthodontics, oral surgery and more."
what is the sikka.ai product for insurance industry,"sikka.ai, which provides oral healthcare indicators (OHI) as well as mortality scores to life insurance companies for underwriting, announced that its data is now being used by multiple carriers for life insurance underwriting through its collaboration with ExamOne."
What is Sikka.ai?,Sikka.ai is a cloud-based platform that offers a range of tools and services to help healthcare professionals optimize their practices.
What modules does Sikka.ai offer?,"Sikka.ai offers a variety of modules, including those for billing, patient communication, marketing, and data analytics."
How does Sikka.ai help dental practices?,"Sikka.ai provides dental practices with tools to help manage their billing, automate patient communication, and monitor key performance indicators (KPIs)."
How does Sikka.ai handle patient data?,Sikka.ai takes the security and privacy of patient data very seriously. The platform is HIPAA-compliant and uses encryption and other security measures to protect patient data.
Can Sikka.ai integrate with my existing practice management software?,"Yes, Sikka.ai can integrate with a variety of practice management software systems, including Dentrix, Eaglesoft, and Open Dental."
How much does Sikka.ai cost?,The cost of using Sikka.ai varies depending on the modules and services that a practice chooses to use. Practices can contact Sikka.ai for a personalized quote based on their specific needs.
Is Sikka.ai easy to use?,"Yes, Sikka.ai is designed to be user-friendly and easy to use, with intuitive interfaces and workflows. Training and support are also provided to help practices get up and running quickly."
What kind of data analytics does Sikka.ai offer?,Sikka.ai offers a variety of data analytics tools to help healthcare professionals monitor key performance indicators (KPIs) and gain insights into their practices.
How does Sikka.ai help with patient communication?,"Sikka.ai offers tools to help automate patient communication, including appointment reminders and follow-up messages."
What marketing tools does Sikka.ai offer?,"Sikka.ai offers marketing tools to help practices attract and retain patients, including patient review management and online reputation management."
Is Sikka.ai HIPAA-compliant?,"Yes, Sikka.ai is HIPAA-compliant and meets the data security standards required by the Health Insurance Portability and Accountability Act."
Can Sikka.ai help with insurance billing?,"Yes, Sikka.ai offers tools to help practices manage their insurance billing and claims processing."
What specialties does Sikka.ai support?,"Sikka.ai offers modules specific to different healthcare specialties, including dentistry, veterinary medicine, and optometry."
How does Sikka.ai handle patient payments?,"Sikka.ai offers tools to help practices manage patient payments, including automated payment processing and payment plan management."
What kind of patient review management does Sikka.ai offer?,Sikka.ai offers tools to help practices manage and respond to patient reviews on popular review websites.
Can Sikka.ai help with inventory management?,"Yes, Sikka.ai offers tools to help practices manage their inventory, including tracking and reporting on inventory levels and automating reorders."
How does Sikka.ai help with staff scheduling?,"Sikka.ai offers tools to help practices manage staff scheduling, including automated scheduling and time tracking."
What kind of data analytics does Sikka.ai offer for dental practices?,"Sikka.ai offers a range of dental-specific KPIs to help practices monitor their performance, including new patient acquisition, case acceptance, and production per visit."
Can Sikka.ai help with patient recall management?,"Yes, Sikka.ai offers tools to help practices manage patient recall and follow-up, including automated recall messages and tracking of patient compliance."
What is SikkaSoft Optimizer?,SikkaSoft Optimizer is a cloud-based platform designed to help healthcare professionals optimize their practice by providing real-time insights and analytics.
How does SikkaSoft Optimizer work?,SikkaSoft Optimizer integrates with a practice's existing software systems to gather data and provide real-time insights into key performance metrics. The platform uses machine learning algorithms to help practices make data-driven decisions about their operations.
What kinds of practices can use SikkaSoft Optimizer?,"SikkaSoft Optimizer is designed to serve a wide range of healthcare practices, including dental, veterinary, and optometry practices."
How can SikkaSoft Optimizer benefit my practice?,"SikkaSoft Optimizer can help practices improve efficiency, reduce costs, and increase revenue by providing real-time insights into key performance metrics, automating routine tasks, and helping practices make informed decisions."
Is SikkaSoft Optimizer easy to use?,"Yes, SikkaSoft Optimizer is designed to be user-friendly and easy to use, with intuitive interfaces and workflows. Training and support are also provided to help practices get up and running quickly."
What modules does SikkaSoft Optimizer offer?,"SikkaSoft Optimizer offers a variety of modules to help practices optimize their operations, including those for patient communication, insurance billing, inventory management, marketing, and more."
Can SikkaSoft Optimizer integrate with my existing practice management software?,"Yes, SikkaSoft Optimizer can integrate with a variety of practice management software systems, including Dentrix, Eaglesoft, and Open Dental."
How does SikkaSoft Optimizer handle patient data?,SikkaSoft Optimizer takes the security and privacy of patient data very seriously. The platform is HIPAA-compliant and uses encryption and other security measures to protect patient data.
How much does SikkaSoft Optimizer cost?,The cost of using SikkaSoft Optimizer varies depending on the modules and services that a practice chooses to use. Practices can contact SikkaSoft for a personalized quote based on their specific needs.
What kind of data analytics does SikkaSoft Optimizer offer?,SikkaSoft Optimizer offers a variety of data analytics tools to help healthcare professionals monitor key performance indicators (KPIs) and gain insights into their practices.
How does SikkaSoft Optimizer help with patient communication?,"SikkaSoft Optimizer offers tools to help automate patient communication, including appointment reminders and follow-up messages."
What marketing tools does SikkaSoft Optimizer offer?,"SikkaSoft Optimizer offers marketing tools to help practices attract and retain patients, including patient review management and online reputation management."
Is SikkaSoft Optimizer HIPAA-compliant?,"Yes, SikkaSoft Optimizer is HIPAA-compliant and meets the data security standards required by the Health Insurance Portability and Accountability Act."
Can SikkaSoft Optimizer help with insurance billing?,"Yes, SikkaSoft Optimizer offers tools to help practices manage their insurance billing and claims processing."
What specialties does SikkaSoft Optimizer support?,"SikkaSoft Optimizer offers modules specific to different healthcare specialties, including dentistry, veterinary medicine, and optometry."
How does SikkaSoft Optimizer handle patient payments?,"SikkaSoft Optimizer offers tools to help practices manage patient payments, including automated payment processing and payment plan management."
Can SikkaSoft Optimizer help with inventory management?,"Yes, SikkaSoft Optimizer offers tools to help practices manage their inventory, including real-time tracking and automated reordering."
How does SikkaSoft Optimizer help with financial reporting?,SikkaSoft Optimizer offers financial reporting tools to help practices monitor their financial performance and make informed decisions about their operations.
Can SikkaSoft Optimizer help with HR management?,"Yes, SikkaSoft Optimizer offers tools to help practices manage their human resources, including employee scheduling and performance tracking."
Does SikkaSoft Optimizer offer real-time data monitoring?,"Yes, SikkaSoft Optimizer provides real-time data monitoring to help practices stay on top of key performance metrics and identify areas for improvement."
Can SikkaSoft Optimizer help with patient engagement?,"Yes, SikkaSoft Optimizer offers tools to help practices engage with patients and provide a better patient experience, including patient surveys and loyalty programs."
What kind of support does SikkaSoft Optimizer offer?,"SikkaSoft Optimizer offers a variety of support options, including online tutorials, phone and email support, and personalized training sessions."
How does SikkaSoft Optimizer help with treatment planning?,"SikkaSoft Optimizer offers tools to help practices create customized treatment plans for their patients, including tools for treatment plan presentation and case acceptance."
Can SikkaSoft Optimizer help with data migration?,"Yes, SikkaSoft Optimizer offers data migration services to help practices transfer their data from their existing software systems to SikkaSoft Optimizer."
How does SikkaSoft Optimizer help with performance benchmarking?,SikkaSoft Optimizer provides tools to help practices benchmark their performance against industry standards and identify areas for improvement.
Can SikkaSoft Optimizer help with recall management?,"Yes, SikkaSoft Optimizer offers tools to help practices manage patient recalls and stay on top of preventive care."
What kind of data security measures does SikkaSoft Optimizer use?,"SikkaSoft Optimizer uses a variety of data security measures, including encryption, access controls, and regular security audits, to protect patient data."
How does SikkaSoft Optimizer help with revenue optimization?,"SikkaSoft Optimizer offers tools to help practices optimize their revenue by improving efficiency, reducing costs, and increasing patient retention."
Can SikkaSoft Optimizer help with patient retention?,"Yes, SikkaSoft Optimizer offers tools to help practices retain patients and improve patient loyalty, including patient engagement tools and loyalty programs."
How does SikkaSoft Optimizer help with insurance verification?,SikkaSoft Optimizer offers tools to help practices verify patient insurance coverage and streamline the insurance billing process.
Can SikkaSoft Optimizer help with compliance management?,"Yes, SikkaSoft Optimizer offers tools to help practices stay compliant with HIPAA and other regulatory requirements."
How does SikkaSoft Optimizer help with staff performance tracking?,SikkaSoft Optimizer offers tools to help practices track employee performance and identify areas for improvement.
Does SikkaSoft Optimizer offer customized reporting?,"Yes, SikkaSoft Optimizer offers customized reporting tools to help practices generate reports tailored to their specific needs and goals."
How can SikkaSoft Optimizer help with practice growth?,SikkaSoft Optimizer offers tools and insights to help practices identify growth opportunities and optimize their operations to achieve sustainable growth.
What is SikkaSoft Dental Analytics?,SikkaSoft Dental Analytics is a cloud-based platform that provides dental practices with insights into their operational and financial performance.
Can SikkaSoft Dental Analytics help improve patient care?,"Yes, SikkaSoft Dental Analytics offers tools to help practices identify areas where they can improve patient care, such as reducing wait times and improving treatment planning."
How does SikkaSoft Dental Analytics help with revenue cycle management?,"SikkaSoft Dental Analytics offers tools to help practices manage their revenue cycle, including tools for insurance billing and collections management."
Can SikkaSoft Dental Analytics help with appointment scheduling?,"Yes, SikkaSoft Dental Analytics offers tools to help practices optimize their appointment scheduling, including tools for patient self-scheduling and automated appointment reminders."
How does SikkaSoft Dental Analytics help with benchmarking?,SikkaSoft Dental Analytics provides benchmarks that allow practices to compare their performance to industry standards and identify areas for improvement.
Can SikkaSoft Dental Analytics help with patient engagement?,"Yes, SikkaSoft Dental Analytics offers tools to help practices engage with patients and provide a better patient experience, such as patient surveys and loyalty programs."
How does SikkaSoft Dental Analytics help with treatment planning?,SikkaSoft Dental Analytics offers tools to help practices create customized treatment plans for their patients and present those plans to patients in a way that is easy to understand.
Can SikkaSoft Dental Analytics help with HR management?,"Yes, SikkaSoft Dental Analytics offers tools to help practices manage their human resources, including employee scheduling and performance tracking."
How does SikkaSoft Dental Analytics help with inventory management?,"SikkaSoft Dental Analytics offers tools to help practices manage their inventory, including real-time tracking and automated reordering."
Can SikkaSoft Dental Analytics help with patient retention?,"Yes, SikkaSoft Dental Analytics offers tools to help practices retain patients and improve patient loyalty, including patient engagement tools and loyalty programs."
How does SikkaSoft Dental Analytics help with compliance management?,SikkaSoft Dental Analytics offers tools to help practices stay compliant with HIPAA and other regulatory requirements.
Can SikkaSoft Dental Analytics help with marketing?,"Yes, SikkaSoft Dental Analytics offers tools to help practices with marketing, such as automated email campaigns and patient referral programs."
How does SikkaSoft Dental Analytics help with financial reporting?,SikkaSoft Dental Analytics offers financial reporting tools to help practices monitor their financial performance and make informed decisions about their operations.
Can SikkaSoft Dental Analytics help with data migration?,"Yes, SikkaSoft Dental Analytics offers data migration services to help practices transfer their data from their existing software systems to SikkaSoft Dental Analytics."
How does SikkaSoft Dental Analytics help with performance tracking?,"SikkaSoft Dental Analytics offers tools to help practices track their performance and identify areas for improvement, such as reducing patient wait times and improving case acceptance rates."
Can SikkaSoft Dental Analytics help with recall management?,"Yes, SikkaSoft Dental Analytics offers tools to help practices manage patient recalls and stay on top of preventive care."
How does SikkaSoft Dental Analytics help with insurance verification?,SikkaSoft Dental Analytics offers tools to help practices verify patient insurance coverage and streamline the insurance billing process.
Can SikkaSoft Dental Analytics help with staff training?,"Yes, SikkaSoft Dental Analytics offers personalized training sessions to help practices train their staff on the use of the platform and best practices for dental practice management."
How does SikkaSoft Dental Analytics ensure data security?,"SikkaSoft Dental Analytics uses advanced security measures to protect practice data, including encryption, firewalls, and access controls."
Can SikkaSoft Dental Analytics help with patient communication?,"Yes, SikkaSoft Dental Analytics offers tools for patient communication, including automated appointment reminders and two-way messaging."
How does SikkaSoft Dental Analytics help with treatment acceptance?,"SikkaSoft Dental Analytics provides tools to help practices improve case acceptance rates, such as treatment plan presentation tools and customized financing options."
Can SikkaSoft Dental Analytics integrate with other software systems?,"Yes, SikkaSoft Dental Analytics can integrate with a wide range of other dental software systems, including practice management software and digital imaging software."
How does SikkaSoft Dental Analytics help with productivity?,"SikkaSoft Dental Analytics offers tools to help practices increase productivity, such as automated tasks and streamlined workflows."
Can SikkaSoft Dental Analytics help with patient demographics analysis?,"Yes, SikkaSoft Dental Analytics provides tools to help practices analyze patient demographics and identify trends in patient behavior and preferences."
How does SikkaSoft Dental Analytics help with financial forecasting?,SikkaSoft Dental Analytics provides financial forecasting tools to help practices plan for the future and make informed decisions about their operations.
Can SikkaSoft Dental Analytics help with insurance claim management?,"Yes, SikkaSoft Dental Analytics offers tools to help practices manage insurance claims and track the status of claims in real-time."
How does SikkaSoft Dental Analytics help with inventory optimization?,"SikkaSoft Dental Analytics provides tools to help practices optimize their inventory levels and reduce waste, such as automated reordering and real-time inventory tracking."
Can SikkaSoft Dental Analytics help with patient segmentation?,"Yes, SikkaSoft Dental Analytics offers tools to help practices segment their patient population and tailor their marketing and outreach efforts to specific patient groups."
How does SikkaSoft Dental Analytics help with accounts receivable management?,SikkaSoft Dental Analytics provides tools to help practices manage their accounts receivable and reduce the amount of outstanding debt owed to the practice.
Can SikkaSoft Dental Analytics help with treatment coding?,"Yes, SikkaSoft Dental Analytics provides tools to help practices ensure accurate treatment coding and billing, reducing the risk of claim denials and delays."
How does SikkaSoft Dental Analytics help with patient loyalty?,"SikkaSoft Dental Analytics offers tools to help practices improve patient loyalty and retention, such as patient referral programs and customized loyalty rewards."
Can SikkaSoft Dental Analytics help with patient reviews?,"Yes, SikkaSoft Dental Analytics offers tools to help practices manage patient reviews and reputation management, such as automated review requests and monitoring of review sites."
How does SikkaSoft Dental Analytics help with patient education?,"SikkaSoft Dental Analytics provides tools to help practices educate patients about their oral health and treatment options, such as educational videos and brochures."
Can SikkaSoft Dental Analytics help with patient outreach?,"Yes, SikkaSoft Dental Analytics offers tools for patient outreach, such as automated email campaigns and targeted messaging based on patient behavior and preferences."
How does SikkaSoft Dental Analytics help with practice branding?,"SikkaSoft Dental Analytics offers tools to help practices build their brand and increase brand awareness, such as custom website design and social media management."
Can SikkaSoft Dental Analytics help with website optimization?,"Yes, SikkaSoft Dental Analytics provides tools to help practices optimize their website for search engines and increase their online visibility."
What is SikkaSoft Veterinary Analytics?,"SikkaSoft Veterinary Analytics is a data analytics platform designed specifically for veterinary practices. It provides insights into key performance indicators, financial metrics, and patient demographics, helping practices optimize their operations and improve their bottom line."
How does SikkaSoft Veterinary Analytics help with patient care?,"SikkaSoft Veterinary Analytics offers tools to help practices improve patient care, such as real-time monitoring of patient vitals and automated reminders for preventive care."
Can SikkaSoft Veterinary Analytics help with inventory management?,"Yes, SikkaSoft Veterinary Analytics provides tools to help practices manage their inventory levels and reduce waste, such as automated reordering and real-time inventory tracking."
How does SikkaSoft Veterinary Analytics help with financial forecasting?,SikkaSoft Veterinary Analytics provides financial forecasting tools to help practices plan for the future and make informed decisions about their operations.
