question,answer
What is Sikka.ai?,Sikka.ai is a cloud platform with Artificial Intelligence and Predictive Analytics that is rethinking the retail healthcare life insurance and markets industries.
Why should I choose Sikka.ai?,You should choose Sikka.ai because it has over 35K practice installations and 139M patients on its platform. Additionally its API connects to 96% of the retail healthcare market practice management systems and financial systems.
How does Sikka.ai's platform work?,Healthcare providers can connect to Sikka.ai's platform to download apps and services to optimize their business and use the power of data to make informed decisions.
What are the key features of Sikka.ai's platform?,Sikka.ai's key features include connectivity to partner services to optimize businesses a range of applications to choose from and insights into five different healthcare verticals.
How many practice installations and patients are on Sikka.ai's platform?,Sikka.ai has over 35K practice installations and 139M human patients on its platform as well as 38M pet patients.
What is Sikka Prime?,Sikka Prime is a tool offered by Sikka.ai that helps healthcare providers get the most out of their practice each day by removing busyness from their business so they can focus on delivering outstanding patient care.
What is the Best Health API Award?,The Best Health API Award is an award that Sikka.ai's ONE API won in 2022 and 2019 from API World. It recognizes the excellence of Sikka.ai's API in the health industry.
Where can I get help from Sikka.ai?,You can request a demo from one of Sikka.ai's conversion specialists or get your questions answered by their product specialists. You can also contact their technical support or find a solution in their FAQ.
What industries is Sikka.ai rethinking?,Sikka.ai is rethinking the retail healthcare life insurance and markets industries using its cloud platform with Artificial Intelligence and Predictive Analytics.
What percentage of the retail healthcare market does Sikka.ai's API connect to?,Sikka.ai's API connects to 96% of the retail healthcare market as well as all practice management systems and financial systems practices use.
What types of applications can I use on Sikka.ai's platform?,You can use a Sikka application or one of their partner applications to optimize the business of your healthcare practice.
What insights does Sikka.ai offer?,Sikka.ai uses its connectivity to offer insights into 5 different healthcare verticals in addition to making your business successful.
What are some of the services offered on Sikka.ai's marketplace?,Sikka.ai's marketplace is filled with optimization tools to gain full control of your practice such as Business Optimization Payment Processing Revenue Cycle Reputation Management and much more!
Who utilizes Sikka.ai's API to build innovative apps?,Sikka.ai's partners many of them Fortune 500 companies utilize the Sikka ONE API to build innovative apps to optimize the business of healthcare.
What is the purpose of Sikka Prime?,"The purpose of Sikka Prime is to remove ""busyness"" from your business so you can deliver outstanding patient care. It is Sikka.ai's newest tool to help you get the most out of your practice each day."
What is the URL for requesting a demo from Sikka.ai?,The URL for requesting a demo from Sikka.ai is https://www.sikka.ai/request-demo.
Where can I contact technical support or find a solution to my problem on Sikka.ai's platform?,You can contact technical support or find a solution to your problem in the FAQ section of Sikka.ai's website. The URL for this section is https://www.sikka.ai/contact-us#technicalSupport.
What is Sikka?,Sikka is a company that provides tailored solutions for dental practices by utilizing its health API platform to help increase efficiency and optimize your practice.
How many dental installations does Sikka have on its platform?,Sikka has over 28000 total dental installations on its platform.
How many dental patients are on Sikka's platform?,Sikka has over 136 million dental patients on its platform.
What is Sikka Prime?,"Sikka Prime is a tool that helps you get the most out of your dental practice each day by removing ""busyness"" from your business so you can deliver outstanding patient care."
What is optimizer?,Optimizer is a tool that helps you optimize your dental practice maximize your profits and easily track your metrics in real time to identify areas of expertise potential improvements and opportunities for growth.
What is SikkaPay and how does it help?,SikkaPay is a tool that uses Sikka's health API platform to streamline the payment process reduce costs and get you paid faster.
What is Fee Survey and how does it help?,Fee Survey is a tool that provides fee recommendations for your most popular dental procedures helping you supercharge your profits and avoid overcharging or undercharging.
What is PatientHomePage and how does it help?,PatientHomePage is a tool that helps strengthen doctor-patient relationships by giving you control over your campaigns patient communications practice calendar and more.
What is Practice Mobilizer and how does it help?,Practice Mobilizer is a tool that allows you to monitor your dental practice from your phone by seamlessly integrating with your PMS to securely access your practice data from anywhere.
Where can I find national trends occurring in the dental industry based on Sikka's data?,You can find national trends occurring in the dental industry based on Sikka's data at https://www.sikka.ai/industry-trends/home.html?vertical=dental.
Who can I contact to learn more about Sikka and the dental industry?,You can contact Roger Telegan Business Leader of Dentistry at roger.telegan@sikka.ai or (408) 404-1977 to learn more about Sikka and the dental industry.
What are some of Sikka's dental products?,Sikka's dental products include Sikka Prime optimizer SikkaPay Fee Survey PatientHomePage and Practice Mobilizer.
What is the purpose of Sikka Prime?,"The purpose of Sikka Prime is to help dental practices get the most out of their business each day by removing ""busyness"" and enabling outstanding patient care."
What is the purpose of optimizer?,The purpose of optimizer is to help dental practices optimize their operations maximize profits and easily track metrics in real-time.
How does SikkaPay streamline the payment process?,SikkaPay streamlines the payment process by utilizing Sikka's health API platform to reduce costs and facilitate faster payments.
What is the Fee Survey tool used for?,The Fee Survey tool is used to provide fee recommendations for popular dental procedures to help dental practices maximize profits and avoid overcharging or undercharging.
What is the purpose of PatientHomePage?,The purpose of PatientHomePage is to help dental practices strengthen doctor-patient relationships by giving control over patient communications practice calendar campaigns and more.
How does Practice Mobilizer allow you to monitor your dental practice?,Practice Mobilizer allows you to monitor your dental practice by integrating with your PMS and enabling secure access to practice data from anywhere using your phone.
Who is Roger Telegan?,Roger Telegan is the Business Leader of Dentistry at Sikka and has over 10 years of experience in working with the executive team on large enterprise customers in the dental industry.
What is Roger Telegan's contact information?,Roger Telegan's contact information includes roger.telegan@sikka.ai (408) 404-1977 https://www.linkedin.com/in/roger-telegan-5008934/ and https://twitter.com/telegan.
What is Roger Telegan's background?,Roger Telegan has strong domain and cloud infrastructure experience as well as a deep understanding of data security and HIPAA compliance. Prior to working at Sikka he worked in a busy dental office in Central California and at AT&T in Data Network and Networking Security.
What is Sikka?,Sikka is a company that provides tailored solutions for veterinary practices by utilizing their award-winning health API platform to help increase efficiency and optimize practices.
How many veterinary practices are on the Sikka platform?,There are 1.6K veterinary practices on the Sikka platform.
How many animal patients are on the Sikka platform?,There are 38M+ animal patients on the Sikka platform.
Which PMS systems are compatible with Sikka?,Advantage AVIMark ClientTrax CornerStone DVMAX HVMS ImpromedInfinity Intravet OpenVPMS StringSoft and VIA are compatible PMS systems with Sikka.
What is the optimizer tool?,The optimizer tool is a dashboard that is updated in real-time to help practices easily track their metrics and optimize their profits.
What is SikkaPay?,SikkaPay is a payment processing tool that uses Sikka's award-winning health API platform to streamline the payment process reduce costs and get practices paid faster.
What is the Fee Survey tool?,The Fee Survey tool is used to provide fee recommendations for a practice's most popular procedures to help optimize profits.
What is Practice Mobilizer?,Practice Mobilizer is a tool that allows practices to monitor their practice from their phone by securely accessing their practice data from anywhere through the Sikka API.
What is the Sikka Marketplace?,The Sikka Marketplace is a collection of optimization tools for veterinary practices including business optimization payment processing revenue cycle management reputation management and more.
Where can I find national trends in the veterinary industry based on Sikka's data?,You can find national trends in the veterinary industry based on Sikka's data of 1.6K practices and 38M+ patients at https://www.sikka.ai/industry-trends/home.html?vertical=veterinary.
How does Vetcabularyâ„¢ work?,Vetcabularyâ„¢ collects and analyzes deidentified data from compatible PMS systems to generate fee data and standardize procedure codes making it easier to focus on patients and maximize profits.
Who can I contact to learn more about Sikka and the veterinary industry?,You can contact Jennifer Scarberry Business Leader of Payments & Veterinary at jennifer.scarberry@sikka.ai or call her directly at (408) 600-0370 to learn more about Sikka and the veterinary industry.
What is the main focus of Sikka's solutions for veterinary practices?,Sikka's main focus is to provide tailored solutions to veterinary practices by using their health API platform to help increase efficiency and optimize the practice.
What is the significance of the optimizer tool for veterinary practices?,The optimizer tool helps veterinary practices to optimize their profits by providing informative dashboards that are updated in real-time and tracking metrics.
How does SikkaPay help veterinary practices to streamline their payment process?,SikkaPay uses Sikka's health API platform to help veterinary practices streamline their payment process reduce costs and get paid faster.
What are the benefits of using Sikka's Fee Survey tool for veterinary practices?,Sikka's Fee Survey tool helps veterinary practices provide fee recommendations for their most popular procedures to avoid overcharging or undercharging and optimize profits.
What is Practice Mobilizer used for?,Practice Mobilizer is a tool that allows veterinary practices to monitor their practice from their phone by securely accessing practice data from anywhere through the Sikka API.
What types of optimization tools are available on Sikka's Marketplace for veterinary practices?,Sikka's Marketplace for veterinary practices is filled with optimization tools such as Business Optimization Payment Processing Revenue Cycle Reputation Management and much more.
What kind of data does Sikka's Vetcabularyâ„¢ collect and analyze to generate fee data and standardize procedure codes?,Vetcabularyâ„¢ collects and analyzes deidentified data from compatible PMS systems to generate fee data and standardize procedure codes for veterinary practices.
How can veterinary practices benefit from national trends in the veterinary industry provided by Sikka's data?,Veterinary practices can benefit from national trends in the veterinary industry provided by Sikka's data by gaining insights into industry trends benchmarking their practice and making data-driven decisions.
What is the role of Jennifer Scarberry at Sikka?,Jennifer Scarberry is the Business Leader of Payments & Veterinary at Sikka and can be contacted to learn more about Sikka and the veterinary industry.
How many physician patients are on the Sikka platform?,123K physician patients are on the Sikka platform.
What are the EHR system compatibilities in the physician industry according to Sikka?,According to Sikka the EHR system compatibilities in the physician industry include Allscripts MedInformatix CGM MEDISOFT ECLIPSE and Physician Products.
What is Sikka's physician product Marketplace?,Sikka's physician product Marketplace is a platform that offers optimization tools to gain full control of your practice such as Business Optimization Payment Processing Revenue Cycle Reputation Management and much more.
What is Practice Mobilizer by Sikka.ai?,Practice Mobilizer by Sikka.ai is a product that allows you to monitor your practice from your phone. The Sikka API seamlessly integrates with your PMS to allow you to securely access your practice data from anywhere.
What are the benefits of using Sikka's Marketplace?,The benefits of using Sikka's Marketplace include gaining full control of your practice with optimization tools for Business Optimization Payment Processing Revenue Cycle Reputation Management and more.
How does Practice Mobilizer help physicians manage their practices?,Practice Mobilizer helps physicians manage their practices by providing a way to securely access practice data from anywhere thanks to its seamless integration with Sikka's PMS API.
Does Sikka's Marketplace offer tools for revenue management?,Yes Sikka's Marketplace offers revenue management tools such as Revenue Cycle Optimization to help optimize billing and payments and increase revenue.
Can Sikka's Practice Mobilizer be used on any mobile device?,Yes Sikka's Practice Mobilizer can be used on any mobile device making it easy to access practice data securely from anywhere.
What type of data can be accessed using Sikka's Practice Mobilizer?,With Sikka's Practice Mobilizer physicians can securely access a range of practice data such as appointment schedules patient records and financial reports.
How does Sikka help optometry practices?,Sikka helps optometry practices by providing tailored solutions utilizing their health API platform to increase efficiency and optimize the practice.
What is the Practice Mobilizer and how does it help optometry practices?,Practice Mobilizer is a tool offered by Sikka which allows optometry practices to monitor their practice from their phone. The Sikka API seamlessly integrates with the PMS to allow secure access to practice data from anywhere.
What kind of tools are available in Sikka's marketplace for optometry practices?,Sikka's marketplace offers various optimization tools such as Business Optimization Payment Processing Revenue Cycle Reputation Management and much more for optometry practices.
How many chiropractic practices are on Sikka's platform?,There are currently over 400 chiropractic practices on the Sikka platform.
How many chiropractic patients are on Sikka's platform?,There are over 1.5 million chiropractic patients on the Sikka platform.
What is Sikka's focus in the chiropractic industry?,Sikka's focus in the chiropractic industry is to provide tailored solutions for chiropractic practices to increase efficiency and optimize their practice.
What kind of tools are available in Sikka's marketplace for chiropractic practices?,Sikka's marketplace offers various optimization tools such as Business Optimization Payment Processing Revenue Cycle Reputation Management and much more for chiropractic practices.
How does Practice Mobilizer help chiropractic practices?,Practice Mobilizer allows chiropractic practices to monitor their practice from their phone. The Sikka API seamlessly integrates with the PMS to allow secure access to practice data from anywhere.
Where can I find national trends occurring in the chiropractic industry according to Sikka's data?,You can find national trends occurring in the chiropractic industry based on Sikka's data of 400+ practices and 1.5M+ patients on their website: https://www.sikka.ai/industry-trends/home.html?vertical=chiropractic
What is Sikka's health API platform used for in optometry practices?,Sikka's health API platform is used to provide tailored solutions for optometry practices to increase efficiency and optimize the practice.
How many optometry patients are on the Sikka platform?,There are over 2 million optometry patients on the Sikka platform.
How many chiropractic patients are on the Sikka platform?,There are over 1.5 million chiropractic patients on the Sikka platform.
What are some of the optimization tools available in Sikka's marketplace?,Some of the optimization tools available in Sikka's marketplace include Business Optimization Payment Processing Revenue Cycle and Reputation Management.
What is Practice Mobilizer?,Practice Mobilizer is a tool offered by Sikka which allows practices to monitor their practice from their phone.
What are the Sikka Health indicators?, Sikka Health indicators are 10 indicators derived from more than 139 million unique records that can be used to identify health risks among insurance applicants.
What is LECA (Life Expectancy at Current Age) Health Risk Score?, LECA (Life Expectancy at Current Age) Health Risk Score is a software platform for measuring mortality risk of an individual based upon their unique dental procedure history.
How does Sikka use machine learning and AI to create health indicators?, Sikka uses a combination of machine learning sophisticated AI and data science to create 10 indicators from oral healthcare data including proprietary Sikka Tobacco Indicatorâ„¢ as well as the LECA (Life Expectancy at Current Age) Health Risk Score.
What is Accelerated Underwriting?, Accelerated Underwriting is a feature where Sikka delivers real-time individual health indicators with notes via an API feed including Sikka's Tobacco Indicatorâ„¢ to facilitate life insurance underwriting and pricing.
What is Real Time Scoring?, Real Time Scoring is a feature where Sikka provides an instant LECA Score on life expectancy as well as indicators that provide information on certain chronic diseases and conditions all with appropriate consent.
How has Sikka's opt-in consent-based data been validated? ,Sikka's opt-in consent-based data has been validated with 9M+ life insurance customers across 18 retrospective studies with major carriers InsurTech companies top Reinsurers and leading data providers having tested Sikka's health indicators and LECA Score.
Why choose Sikka?, Sikka is well-positioned to be the premier provider of opt-in consent-based oral care data to the life insurance industry with over 50% share of oral care patient data and world-class data architects and data scientists who gather store categorize deliver and analyze data with great precision and agility.
What are the benefits of using Sikka's data for insurance carriers and insuretech startups?, Benefits of using Sikka's data include more accurate individual mortality estimates more consistency in underwriting practices more precision than expert judgment (manual underwriting) improved fraud detection reduction in the cost and time to underwrite each applicant refined segmentation of discrete underwriting classes and reduced complexity and friction in onboarding policyholder.
What are the Sikka Health indicators, and how do they help determine the proper life insurance policy? Sikka Health indicators are ten health indicators from opt-in consent-based data derived from more than 139M+ unique records which assist in determining the proper life insurance policy based on the applicantâ€™s health risk indicators ensuring that premiums are only applied where needed.
What is the Sikka Tobacco Indicatorâ„¢?, The Sikka Tobacco Indicatorâ„¢ is generated for an individual based on his or her dental clinical notes and completed oral health evaluations which have been fed through a machine-learning model and is assigned to one of two classes: tobacco user (T) or no evidence of tobacco use (NE).
What is the Munich Re study on Sikka's Tobacco Score?, The Munich Re study is a validation of Sikkaâ€™s Tobacco Score using insured records confirming that information about dental health can be informative about overall health and recommends each carrier perform a retrospective study to best assess the value and application of the Sikka Tobacco Score on its company-specific insured population.
What are Sikka Health indicators?,Sikka Health indicators are 10 indicators derived from more than 139 million unique records that can be used to identify health risks among insurance applicants based on oral healthcare data.
What is the LECA Health Risk Score and how does it work?,The LECA Health Risk Score is a software platform that measures the mortality risk of an individual based on their unique dental procedure history. It uses a proprietary algorithm to analyze the data and generate a score that can be used by insurance companies to make underwriting decisions.
What are some of the health risks that Sikka Health indicators can identify?,"Blood Disease,Cancer,Cardiovascular,Diabetes,Hyperlipidemia,Hypertension,Kidney Disease,Liver Disease,Tobacco,Other"
What is the Sikka Tobacco Indicator  and how is it generated?,The Sikka Tobacco Indicatorâ„¢ is generated for an individual based on their dental clinical notes and completed oral health evaluations which are fed through a machine-learning model. The patient's records are then assigned to one of two classes: tobacco user (T) or no evidence of tobacco use (NE).
How has Sikka's data been validated?,"Sikka’s data has been validated in studies conducted by 3 major reinsurance companies, 3 leading data providers, several carriers and MGAs in both the US and Canada, and a leading life settlement company. These studies range from a select 2,500 to an expansive 8,000,000 records and have match rates of up to 54%."
How does Sikka provide real-time individual health indicators to insurance companies?,"At Sikka, we use a combination of machine learning, sophisticated AI and data science to create 10 indicators from our oral healthcare data include our proprietary Sikka Tobacco Indicator™ as well as the LECA (Life Expectancy at Current Age) Health Risk Score®, all of which can help insurance companies deliver real-time decisions for underwriting."
What is the Munich Re Study and what does it say about Sikka's Tobacco Score?,The Munich Re Study is a validation of Sikka's Tobacco Score using insured records. The study confirms that information about dental health can be informative about overall health and products like Sikka's tap into this alternative source of information. Munich Re recommends that each carrier perform a retrospective study to best assess the value and application of the Sikka Tobacco Score on its company-specific insured population.
What makes Sikka well-positioned to be the premier provider of oral care data to the life insurance industry?,Sikka has over 50% share of oral care patient data giving it a breadth and depth of opt-in consent-based data that no other source can match. Sikka also has world-class data architects and data scientists who gather store categorize deliver and analyze data with great precision and agility.
What does Sikka offer in Revenue Cycle Management?,Sikka offers solutions for Dental Veterinary Physician Optometry Chiropractic Insurance revenue cycle management including SikkaPay.
What is SikkaPay?,SikkaPay is an integrated payment solution that streamlines the payment process reduces costs and enables faster payment.
What is the purpose of Sikka's solutions in Revenue Cycle Management?,Sikka's solutions aim to streamline and optimize the business process allowing healthcare providers to focus on managing their practice and providing the best care to patients.
What is Sikka Insights?,Sikka Insights is a platform that collects up-to-the-minute consent-based de-identified data from healthcare providers to provide actionable predictions of the performance of specific public companies in the healthcare sectors.
What kind of data does Sikka Insights collect?,Sikka Insights collects opt-in consent-based data regarding patients payment transactions and more.
How does Sikka Insights help in market insights?,Sikka Insights utilizes sophisticated AI that allows for clinical notes to be parsed identifying the use of specific products and provides market insights by measuring the use of specialized equipment raw materials pharmaceuticals and services.
What does Sikka offer?,Sikka offers solutions for revenue cycle management and market insights.
What is SikkaPay used for?,SikkaPay is used to streamline the payment process reduce costs and enable faster payment.
What is the focus of Sikka's solutions?,Sikka's solutions focus on streamlining and optimizing the business process allowing healthcare providers to manage their practice and provide the best care to patients.
What is the purpose of Sikka Insights?,Sikka Insights is used to provide actionable predictions of the performance of specific public companies in the healthcare sectors.
What type of data does Sikka Insights collect?,Sikka Insights collects opt-in consent-based data regarding patients payment transactions and more from healthcare providers.
